{
  "$schema": "https://json-schema.org/draft/2020-12/schema",
  "$id": "https://plexusone.dev/systemspec-apistyle/schema/v1/api-style-spec.schema.json",
  "$defs": {
    "CasingRules": {
      "properties": {
        "paths": {
          "type": "string"
        },
        "parameters": {
          "type": "string"
        },
        "properties": {
          "type": "string"
        },
        "headers": {
          "type": "string"
        }
      },
      "additionalProperties": false,
      "type": "object"
    },
    "Category": {
      "properties": {
        "id": {
          "type": "string"
        },
        "title": {
          "type": "string"
        },
        "description": {
          "type": "string"
        },
        "order": {
          "type": "integer"
        }
      },
      "additionalProperties": false,
      "type": "object"
    },
    "CodeAnnotation": {
      "properties": {
        "line": {
          "type": "integer"
        },
        "endLine": {
          "type": "integer"
        },
        "text": {
          "type": "string"
        },
        "type": {
          "type": "string"
        }
      },
      "additionalProperties": false,
      "type": "object"
    },
    "Condition": {
      "properties": {
        "when": {
          "type": "string"
        },
        "expression": {
          "type": "string"
        },
        "then": {
          "type": "string"
        },
        "unless": {
          "type": "string"
        }
      },
      "additionalProperties": false,
      "type": "object"
    },
    "ConformanceLevel": {
      "properties": {
        "description": {
          "type": "string"
        },
        "requiredCategories": {
          "items": {
            "type": "string"
          },
          "type": "array"
        },
        "requiredRules": {
          "items": {
            "type": "string"
          },
          "type": "array"
        },
        "maxErrors": {
          "type": "integer"
        },
        "maxWarnings": {
          "type": "integer"
        },
        "extends": {
          "type": "string"
        }
      },
      "additionalProperties": false,
      "type": "object"
    },
    "DecisionRow": {
      "properties": {
        "values": {
          "items": {
            "type": "string"
          },
          "type": "array"
        },
        "highlight": {
          "type": "boolean"
        }
      },
      "additionalProperties": false,
      "type": "object"
    },
    "DecisionTable": {
      "properties": {
        "title": {
          "type": "string"
        },
        "description": {
          "type": "string"
        },
        "headers": {
          "items": {
            "type": "string"
          },
          "type": "array"
        },
        "rows": {
          "items": {
            "$ref": "#/$defs/DecisionRow"
          },
          "type": "array"
        }
      },
      "additionalProperties": false,
      "type": "object"
    },
    "DeprecationInfo": {
      "properties": {
        "version": {
          "type": "string"
        },
        "message": {
          "type": "string"
        },
        "replacedBy": {
          "items": {
            "type": "string"
          },
          "type": "array"
        },
        "removalVersion": {
          "type": "string"
        }
      },
      "additionalProperties": false,
      "type": "object"
    },
    "DetailedExample": {
      "properties": {
        "title": {
          "type": "string"
        },
        "description": {
          "type": "string"
        },
        "type": {
          "type": "string"
        },
        "language": {
          "type": "string"
        },
        "code": {
          "type": "string"
        },
        "annotations": {
          "items": {
            "$ref": "#/$defs/CodeAnnotation"
          },
          "type": "array"
        },
        "before": {
          "type": "string"
        },
        "after": {
          "type": "string"
        }
      },
      "additionalProperties": false,
      "type": "object"
    },
    "Diagram": {
      "properties": {
        "title": {
          "type": "string"
        },
        "type": {
          "type": "string"
        },
        "content": {
          "type": "string"
        },
        "alt": {
          "type": "string"
        }
      },
      "additionalProperties": false,
      "type": "object"
    },
    "Enforcement": {
      "properties": {
        "type": {
          "type": "string"
        },
        "function": {
          "type": "string"
        },
        "options": {
          "$ref": "#/$defs/EnforcementOptions"
        },
        "given": {
          "$ref": "#/$defs/GivenPaths"
        },
        "then": {
          "$ref": "#/$defs/SpectralThen"
        },
        "pattern": {
          "type": "string"
        },
        "customFunction": {
          "type": "string"
        }
      },
      "additionalProperties": false,
      "type": "object"
    },
    "EnforcementOptions": {
      "properties": {
        "match": {
          "type": "string"
        },
        "notMatch": {
          "type": "string"
        },
        "min": {
          "type": "integer"
        },
        "max": {
          "type": "integer"
        },
        "values": {
          "items": {
            "type": "string"
          },
          "type": "array"
        },
        "type": {
          "type": "string"
        },
        "separator": {
          "type": "string"
        },
        "schema": {
          "type": "string"
        }
      },
      "additionalProperties": false,
      "type": "object"
    },
    "Examples": {
      "properties": {
        "good": {
          "items": {
            "type": "string"
          },
          "type": "array"
        },
        "bad": {
          "items": {
            "type": "string"
          },
          "type": "array"
        },
        "detailed": {
          "items": {
            "$ref": "#/$defs/DetailedExample"
          },
          "type": "array"
        }
      },
      "additionalProperties": false,
      "type": "object"
    },
    "Exception": {
      "properties": {
        "id": {
          "type": "string"
        },
        "ruleId": {
          "type": "string"
        },
        "appliesTo": {
          "$ref": "#/$defs/ExceptionScope"
        },
        "reason": {
          "type": "string"
        },
        "approvedBy": {
          "type": "string"
        },
        "approvedOn": {
          "type": "string",
          "format": "date-time"
        },
        "expiresOn": {
          "type": "string",
          "format": "date-time"
        },
        "ticket": {
          "type": "string"
        }
      },
      "additionalProperties": false,
      "type": "object"
    },
    "ExceptionScope": {
      "properties": {
        "api": {
          "type": "string"
        },
        "path": {
          "type": "string"
        },
        "operation": {
          "type": "string"
        },
        "paths": {
          "items": {
            "type": "string"
          },
          "type": "array"
        }
      },
      "additionalProperties": false,
      "type": "object"
    },
    "ForbiddenTerm": {
      "properties": {
        "term": {
          "type": "string"
        },
        "replaceWith": {
          "type": "string"
        },
        "reason": {
          "type": "string"
        }
      },
      "additionalProperties": false,
      "type": "object"
    },
    "GivenPaths": {
      "properties": {
        "paths": {
          "items": {
            "type": "string"
          },
          "type": "array"
        }
      },
      "additionalProperties": false,
      "type": "object"
    },
    "GlossaryTerm": {
      "properties": {
        "term": {
          "type": "string"
        },
        "definition": {
          "type": "string"
        },
        "aliases": {
          "items": {
            "type": "string"
          },
          "type": "array"
        }
      },
      "additionalProperties": false,
      "type": "object"
    },
    "JudgeCriteria": {
      "properties": {
        "prompt": {
          "type": "string"
        },
        "weight": {
          "type": "number"
        },
        "requiresContext": {
          "type": "boolean"
        },
        "category": {
          "type": "string"
        },
        "passCriteria": {
          "items": {
            "type": "string"
          },
          "type": "array"
        },
        "partialCriteria": {
          "items": {
            "type": "string"
          },
          "type": "array"
        },
        "failCriteria": {
          "items": {
            "type": "string"
          },
          "type": "array"
        },
        "examples": {
          "$ref": "#/$defs/JudgeExamples"
        },
        "scaleType": {
          "type": "string"
        }
      },
      "additionalProperties": false,
      "type": "object"
    },
    "JudgeExample": {
      "properties": {
        "excerpt": {
          "type": "string"
        },
        "reasoning": {
          "type": "string"
        }
      },
      "additionalProperties": false,
      "type": "object"
    },
    "JudgeExamples": {
      "properties": {
        "pass": {
          "$ref": "#/$defs/JudgeExample"
        },
        "partial": {
          "$ref": "#/$defs/JudgeExample"
        },
        "fail": {
          "$ref": "#/$defs/JudgeExample"
        }
      },
      "additionalProperties": false,
      "type": "object"
    },
    "Lexicon": {
      "properties": {
        "approved": {
          "items": {
            "type": "string"
          },
          "type": "array"
        },
        "forbidden": {
          "items": {
            "$ref": "#/$defs/ForbiddenTerm"
          },
          "type": "array"
        },
        "aliases": {
          "additionalProperties": {
            "type": "string"
          },
          "type": "object"
        },
        "casingRules": {
          "$ref": "#/$defs/CasingRules"
        }
      },
      "additionalProperties": false,
      "type": "object"
    },
    "MigrationGuidance": {
      "properties": {
        "summary": {
          "type": "string"
        },
        "steps": {
          "items": {
            "$ref": "#/$defs/MigrationStep"
          },
          "type": "array"
        },
        "autoFixAvailable": {
          "type": "boolean"
        },
        "effort": {
          "type": "string"
        },
        "breakingChange": {
          "type": "boolean"
        }
      },
      "additionalProperties": false,
      "type": "object"
    },
    "MigrationStep": {
      "properties": {
        "order": {
          "type": "integer"
        },
        "description": {
          "type": "string"
        },
        "code": {
          "type": "string"
        },
        "language": {
          "type": "string"
        }
      },
      "additionalProperties": false,
      "type": "object"
    },
    "Pattern": {
      "properties": {
        "id": {
          "type": "string"
        },
        "name": {
          "type": "string"
        },
        "category": {
          "type": "string"
        },
        "summary": {
          "type": "string"
        },
        "description": {
          "type": "string"
        },
        "problem": {
          "type": "string"
        },
        "solution": {
          "type": "string"
        },
        "when": {
          "type": "string"
        },
        "examples": {
          "items": {
            "$ref": "#/$defs/DetailedExample"
          },
          "type": "array"
        },
        "relatedRules": {
          "items": {
            "type": "string"
          },
          "type": "array"
        },
        "relatedPatterns": {
          "items": {
            "type": "string"
          },
          "type": "array"
        },
        "references": {
          "items": {
            "$ref": "#/$defs/Reference"
          },
          "type": "array"
        },
        "diagrams": {
          "items": {
            "$ref": "#/$defs/Diagram"
          },
          "type": "array"
        }
      },
      "additionalProperties": false,
      "type": "object"
    },
    "Principle": {
      "properties": {
        "id": {
          "type": "string"
        },
        "title": {
          "type": "string"
        },
        "description": {
          "type": "string"
        },
        "relatedRules": {
          "items": {
            "type": "string"
          },
          "type": "array"
        }
      },
      "additionalProperties": false,
      "type": "object"
    },
    "Reference": {
      "properties": {
        "title": {
          "type": "string"
        },
        "url": {
          "type": "string"
        }
      },
      "additionalProperties": false,
      "type": "object"
    },
    "Rule": {
      "properties": {
        "id": {
          "type": "string"
        },
        "title": {
          "type": "string"
        },
        "category": {
          "type": "string"
        },
        "severity": {
          "type": "string"
        },
        "scope": {
          "type": "string"
        },
        "rationale": {
          "type": "string"
        },
        "description": {
          "type": "string"
        },
        "background": {
          "type": "string"
        },
        "sectionRef": {
          "type": "string"
        },
        "priority": {
          "type": "integer"
        },
        "version": {
          "type": "string"
        },
        "deprecated": {
          "$ref": "#/$defs/DeprecationInfo"
        },
        "examples": {
          "$ref": "#/$defs/Examples"
        },
        "enforcement": {
          "$ref": "#/$defs/Enforcement"
        },
        "judge": {
          "$ref": "#/$defs/JudgeCriteria"
        },
        "references": {
          "items": {
            "$ref": "#/$defs/Reference"
          },
          "type": "array"
        },
        "tags": {
          "items": {
            "type": "string"
          },
          "type": "array"
        },
        "recommended": {
          "type": "boolean"
        },
        "applicability": {
          "$ref": "#/$defs/RuleApplicability"
        },
        "conditions": {
          "items": {
            "$ref": "#/$defs/Condition"
          },
          "type": "array"
        },
        "relations": {
          "items": {
            "$ref": "#/$defs/RuleRelation"
          },
          "type": "array"
        },
        "decisionTables": {
          "items": {
            "$ref": "#/$defs/DecisionTable"
          },
          "type": "array"
        },
        "migration": {
          "$ref": "#/$defs/MigrationGuidance"
        }
      },
      "additionalProperties": false,
      "type": "object"
    },
    "RuleApplicability": {
      "properties": {
        "apiTypes": {
          "items": {
            "type": "string"
          },
          "type": "array"
        },
        "openAPIVersions": {
          "items": {
            "type": "string"
          },
          "type": "array"
        },
        "httpMethods": {
          "items": {
            "type": "string"
          },
          "type": "array"
        },
        "contexts": {
          "items": {
            "type": "string"
          },
          "type": "array"
        },
        "includePatterns": {
          "items": {
            "type": "string"
          },
          "type": "array"
        },
        "excludePatterns": {
          "items": {
            "type": "string"
          },
          "type": "array"
        }
      },
      "additionalProperties": false,
      "type": "object"
    },
    "RuleOverride": {
      "properties": {
        "severity": {
          "type": "string"
        },
        "disabled": {
          "type": "boolean"
        },
        "rationale": {
          "type": "string"
        }
      },
      "additionalProperties": false,
      "type": "object"
    },
    "RuleRelation": {
      "properties": {
        "ruleId": {
          "type": "string"
        },
        "type": {
          "type": "string"
        },
        "description": {
          "type": "string"
        }
      },
      "additionalProperties": false,
      "type": "object"
    },
    "Section": {
      "properties": {
        "id": {
          "type": "string"
        },
        "title": {
          "type": "string"
        },
        "description": {
          "type": "string"
        },
        "order": {
          "type": "integer"
        },
        "parentId": {
          "type": "string"
        },
        "rules": {
          "items": {
            "type": "string"
          },
          "type": "array"
        },
        "patterns": {
          "items": {
            "type": "string"
          },
          "type": "array"
        },
        "introduction": {
          "type": "string"
        },
        "content": {
          "type": "string"
        }
      },
      "additionalProperties": false,
      "type": "object"
    },
    "SpecMetadata": {
      "properties": {
        "author": {
          "type": "string"
        },
        "license": {
          "type": "string"
        },
        "repository": {
          "type": "string"
        },
        "website": {
          "type": "string"
        },
        "url": {
          "type": "string"
        },
        "contact": {
          "type": "string"
        },
        "lastUpdated": {
          "type": "string"
        }
      },
      "additionalProperties": false,
      "type": "object"
    },
    "SpectralThen": {
      "properties": {
        "field": {
          "type": "string"
        },
        "function": {
          "type": "string"
        },
        "functionOptions": {
          "additionalProperties": {
            "type": "string"
          },
          "type": "object"
        }
      },
      "additionalProperties": false,
      "type": "object"
    }
  },
  "properties": {
    "$schema": {
      "type": "string"
    },
    "version": {
      "type": "string"
    },
    "name": {
      "type": "string"
    },
    "description": {
      "type": "string"
    },
    "introduction": {
      "type": "string"
    },
    "extends": {
      "items": {
        "type": "string"
      },
      "type": "array"
    },
    "rules": {
      "items": {
        "$ref": "#/$defs/Rule"
      },
      "type": "array"
    },
    "overrides": {
      "additionalProperties": {
        "$ref": "#/$defs/RuleOverride"
      },
      "type": "object"
    },
    "lexicon": {
      "$ref": "#/$defs/Lexicon"
    },
    "conformanceLevels": {
      "additionalProperties": {
        "$ref": "#/$defs/ConformanceLevel"
      },
      "type": "object"
    },
    "exceptions": {
      "items": {
        "$ref": "#/$defs/Exception"
      },
      "type": "array"
    },
    "categories": {
      "items": {
        "$ref": "#/$defs/Category"
      },
      "type": "array"
    },
    "patterns": {
      "items": {
        "$ref": "#/$defs/Pattern"
      },
      "type": "array"
    },
    "sections": {
      "items": {
        "$ref": "#/$defs/Section"
      },
      "type": "array"
    },
    "glossary": {
      "items": {
        "$ref": "#/$defs/GlossaryTerm"
      },
      "type": "array"
    },
    "principles": {
      "items": {
        "$ref": "#/$defs/Principle"
      },
      "type": "array"
    },
    "metadata": {
      "$ref": "#/$defs/SpecMetadata"
    }
  },
  "additionalProperties": false,
  "type": "object"
}