{
  "$schema": "https://raw.githubusercontent.com/plexusone/systemspec-apistyle/main/schema/api-style-spec.schema.json",
  "version": "1.0.0",
  "name": "Microsoft REST API Guidelines",
  "description": "Comprehensive style rules based on Microsoft Azure REST API Guidelines and Microsoft REST API Guidelines. This profile includes ~120 rules covering versioning, URI design, HTTP semantics, error handling, pagination, long-running operations, naming conventions, security, and more.",
  "introduction": "The Microsoft REST API Guidelines are a set of best practices for building consistent, reliable, and user-friendly REST APIs. These guidelines have evolved over many years of API development at Microsoft and represent lessons learned across Azure, Microsoft 365, and other Microsoft services.\n\nThis style specification formalizes these guidelines into machine-checkable rules that can be enforced during API design review and validation.",
  "metadata": {
    "author": "Microsoft",
    "url": "https://github.com/microsoft/api-guidelines",
    "repository": "https://github.com/microsoft/api-guidelines",
    "license": "CC-BY-4.0",
    "lastUpdated": "2024-12-01"
  },
  "principles": [
    {
      "id": "consistency",
      "title": "Consistency",
      "description": "APIs should be consistent with other Microsoft APIs and with common REST conventions. Developers who know one Microsoft API should feel comfortable with others.",
      "relatedRules": ["MS-URI-001", "MS-NAME-001", "MS-REQ-001"]
    },
    {
      "id": "simplicity",
      "title": "Simplicity",
      "description": "APIs should be simple to understand and use. Avoid unnecessary complexity, and prefer common patterns over custom ones.",
      "relatedRules": ["MS-URI-004", "MS-ERR-001"]
    },
    {
      "id": "predictability",
      "title": "Predictability",
      "description": "API behavior should be predictable. Developers should be able to guess how an API works based on general REST knowledge.",
      "relatedRules": ["MS-HTTP-001", "MS-HTTP-002", "MS-HTTP-003"]
    },
    {
      "id": "discoverability",
      "title": "Discoverability",
      "description": "APIs should be self-documenting and discoverable. Use hypermedia where appropriate to guide clients.",
      "relatedRules": ["MS-PAGE-001", "MS-LRO-001"]
    },
    {
      "id": "extensibility",
      "title": "Extensibility",
      "description": "APIs should be designed to evolve without breaking existing clients. Use versioning and optional fields appropriately.",
      "relatedRules": ["MS-VER-001", "MS-VER-002", "MS-COMPAT-001"]
    }
  ],
  "categories": [
    {"id": "versioning", "title": "API Versioning", "description": "Version management, compatibility, and evolution strategies", "order": 1},
    {"id": "uri-design", "title": "URI Design", "description": "Path structure, resource naming, and URL conventions", "order": 2},
    {"id": "http-methods", "title": "HTTP Methods", "description": "Proper use of GET, POST, PUT, PATCH, DELETE, and other HTTP verbs", "order": 3},
    {"id": "request-response", "title": "Request/Response", "description": "Payload structure, formats, and content negotiation", "order": 4},
    {"id": "errors", "title": "Error Handling", "description": "Error response format, codes, and troubleshooting", "order": 5},
    {"id": "pagination", "title": "Pagination", "description": "Collection paging patterns and query options", "order": 6},
    {"id": "filtering", "title": "Filtering and Sorting", "description": "Query parameters for filtering, sorting, and selecting data", "order": 7},
    {"id": "long-running", "title": "Long Running Operations", "description": "Async operation patterns and status polling", "order": 8},
    {"id": "naming", "title": "Naming Conventions", "description": "Property, field, and schema naming standards", "order": 9},
    {"id": "security", "title": "Security", "description": "Authentication, authorization, and data protection", "order": 10},
    {"id": "headers", "title": "HTTP Headers", "description": "Standard and custom header usage", "order": 11},
    {"id": "schema-design", "title": "Schema Design", "description": "JSON Schema structure and data types", "order": 12},
    {"id": "collections", "title": "Collections", "description": "List operations and collection management", "order": 13},
    {"id": "conditional", "title": "Conditional Requests", "description": "ETags, If-Match, and optimistic concurrency", "order": 14},
    {"id": "compatibility", "title": "Compatibility", "description": "Breaking changes and evolution guidelines", "order": 15}
  ],
  "sections": [
    {
      "id": "introduction",
      "title": "Introduction",
      "description": "Overview of Microsoft REST API Guidelines",
      "order": 1,
      "introduction": "These guidelines establish a foundation for API design that promotes consistency across Microsoft services."
    },
    {
      "id": "fundamentals",
      "title": "API Fundamentals",
      "description": "Core concepts and principles",
      "order": 2,
      "rules": ["MS-VER-001", "MS-VER-002", "MS-URI-001", "MS-URI-002"]
    },
    {
      "id": "resources",
      "title": "Resources and Operations",
      "description": "Resource modeling and CRUD operations",
      "order": 3,
      "rules": ["MS-HTTP-001", "MS-HTTP-002", "MS-HTTP-003", "MS-HTTP-004"]
    },
    {
      "id": "data",
      "title": "Data Formats",
      "description": "Request and response payloads",
      "order": 4,
      "rules": ["MS-REQ-001", "MS-REQ-002", "MS-REQ-003"]
    }
  ],
  "patterns": [
    {
      "id": "pagination-pattern",
      "name": "Server-Driven Pagination",
      "category": "collections",
      "summary": "Use server-driven pagination with nextLink for large collections",
      "problem": "Collections may contain more items than can be efficiently returned in a single response.",
      "solution": "Return partial results with a nextLink URL pointing to the next page of results.",
      "when": "When returning collections that may contain many items",
      "examples": [
        {
          "title": "Paginated Response",
          "type": "good",
          "language": "json",
          "code": "{\n  \"value\": [\n    {\"id\": \"1\", \"name\": \"Item 1\"},\n    {\"id\": \"2\", \"name\": \"Item 2\"}\n  ],\n  \"nextLink\": \"https://api.example.com/items?$skip=2&$top=2\"\n}"
        }
      ],
      "relatedRules": ["MS-PAGE-001", "MS-PAGE-002", "MS-PAGE-003"]
    },
    {
      "id": "lro-pattern",
      "name": "Long Running Operations",
      "category": "async",
      "summary": "Use 202 Accepted with Location header for long-running operations",
      "problem": "Some operations take too long to complete within a single HTTP request timeout.",
      "solution": "Return 202 Accepted immediately with a Location header pointing to a status monitor endpoint.",
      "when": "When operations may take more than a few seconds to complete",
      "examples": [
        {
          "title": "Initial Response",
          "type": "good",
          "language": "http",
          "code": "HTTP/1.1 202 Accepted\nLocation: https://api.example.com/operations/abc123\nRetry-After: 30"
        }
      ],
      "relatedRules": ["MS-LRO-001", "MS-LRO-002", "MS-LRO-003"],
      "diagrams": [
        {
          "title": "LRO Flow",
          "type": "mermaid",
          "content": "sequenceDiagram\n    participant C as Client\n    participant A as API\n    C->>A: POST /resource\n    A->>C: 202 Accepted + Location\n    loop Until Complete\n        C->>A: GET /operations/id\n        A->>C: 200 OK (status: running)\n    end\n    C->>A: GET /operations/id\n    A->>C: 200 OK (status: succeeded)"
        }
      ]
    },
    {
      "id": "error-pattern",
      "name": "Standard Error Response",
      "category": "errors",
      "summary": "Use consistent error response format with code, message, and details",
      "problem": "Inconsistent error formats make it hard for clients to handle errors programmatically.",
      "solution": "Use a standard error envelope with required code and message fields.",
      "when": "When returning 4xx or 5xx responses",
      "examples": [
        {
          "title": "Standard Error",
          "type": "good",
          "language": "json",
          "code": "{\n  \"error\": {\n    \"code\": \"InvalidParameter\",\n    \"message\": \"The 'name' parameter must be between 1 and 100 characters.\",\n    \"target\": \"name\",\n    \"details\": []\n  }\n}"
        }
      ],
      "relatedRules": ["MS-ERR-001", "MS-ERR-002", "MS-ERR-003", "MS-ERR-004"]
    },
    {
      "id": "etag-pattern",
      "name": "Optimistic Concurrency with ETags",
      "category": "concurrency",
      "summary": "Use ETags and If-Match headers for optimistic concurrency control",
      "problem": "Concurrent updates to the same resource can overwrite each other's changes.",
      "solution": "Return ETags with resources and require If-Match headers on update requests.",
      "when": "When resources can be updated by multiple clients",
      "examples": [
        {
          "title": "Conditional Update",
          "type": "good",
          "language": "http",
          "code": "PATCH /users/123 HTTP/1.1\nIf-Match: \"abc123\"\nContent-Type: application/json\n\n{\"name\": \"Updated Name\"}"
        }
      ],
      "relatedRules": ["MS-COND-001", "MS-COND-002", "MS-COND-003"]
    }
  ],
  "glossary": [
    {"term": "Resource", "definition": "An entity exposed by the API, identified by a URI."},
    {"term": "Collection", "definition": "A set of resources of the same type."},
    {"term": "Operation", "definition": "An action performed on a resource using an HTTP method."},
    {"term": "LRO", "definition": "Long Running Operation - an operation that takes more than a few seconds to complete."},
    {"term": "ETag", "definition": "Entity Tag - a version identifier for a resource used in conditional requests."},